{
  "$schema": "./__json/app.json",
  "clients": {
    "test": {
      "role": "Owner",
      "name": null
    }
  },
  "roles": {
    "custom": {
      "permissions": ["schemas.*"]
    }
  },
  "languages": {
    "en": {
      "isMaster": true,
      "isOptional": false
    }
  },
  "contributors": {
    "sebastian@squidex.io": {
      "role": "Owner"
    }
  }
}
